Bacteria Name,Type,Significance
Escherichia coli (E. coli),Gram-negative bacterium,Common gut bacterium; dysbiosis indicator
Lactobacillus acidophilus,Gram-positive bacterium,Probiotic; gut health maintenance
Bifidobacterium spp.,Gram-positive bacterium,Decreases with age; reduced gut diversity
Prevotella spp.,Gram-negative bacterium,Fiber-rich diet; longevity marker
Faecalibacterium prausnitzii,Gram-positive bacterium,Anti-inflammatory; reduced in elderly
Akkermansia muciniphila,Gram-negative bacterium,Healthy aging marker; metabolic health
Ruminococcus spp.,Gram-positive bacterium,Digestive health; changes linked to aging
Streptococcus spp.,Gram-positive bacterium,Pathogenic in elderly; immunocompromised risk
Clostridium cluster IV and XIVa,Gram-positive bacterium,SCFA production; changes with aging
Bacteroides spp.,Gram-negative bacterium,Dominant in youth; decreases in elderly
